,rand_point,COMMUNE,POP_TOT,MENAGES,AREA,DENSITE,DENS_URB,DENS_RUR,Shape_Area,Shape_Leng,NUMTram_St,NUMBus_Sta,Leng_Prima,Count_Prim,Leng_Secon,Count_Seco,Num_Speed_,Leng_Motor,Count_Moto,Zone_Area,Indu_Area,Commercial,residencia,Park_Area,University,Parking_Ar,geometry,address
36,36.0,Hay Hassani,140728.03125,26403.5,502900.9375,7957.65087890625,7843.76171875,113.88937377929688,0.004520093556494,0.291974395513535,20.0,62.0,10584.781062319435,36.0,33114.512602738345,146.0,0.0,3178.0179682038997,19.0,15351330.37,18249.94,12345.63,25737555.349999998,341715.85,808420.0700000001,108370.88,POINT (-7.669169627366986 33.56891990079279),"Lycée Ibn Al Yassamine, Boulevard d'Oued Oum Rabia, Anfa Cité de l'Air, Hay Hassani ⵃⴰⵢ ⵍⵃⴰⵙⴰⵏⵉ حي الحسني, Casablanca ⵜⵉⴳⵎⵉ ⵜⵓⵎⵍⵉⵍⵜ الدار البيضاء, Pachalik de Casablanca, Préfecture de Casablanca عمالة الدار البيضاء, Casablanca-Settat ⵜⵉⴳⵎⵉ ⵜⵓⵎⵍⵉⵍⵜ-ⵙⵟⵟⴰⵜ الدار البيضاء-سطات, 20230, Maroc / ⵍⵎⵖⵔⵉⴱ / المغرب"
37,37.0,Hay Hassani,140728.03125,26403.5,502900.9375,7957.65087890625,7843.76171875,113.88937377929688,0.004520093556494,0.291974395513535,20.0,62.0,10584.781062319435,36.0,33114.512602738345,146.0,0.0,3178.0179682038997,19.0,15351330.37,18249.94,12345.63,25737555.349999998,341715.85,808420.0700000001,108370.88,POINT (-7.665145749112807 33.55421702823332),"Main Street شارع رئيسي, Main Street Sud شارع رئيسي الجنوب, Hay Hassani ⵃⴰⵢ ⵍⵃⴰⵙⴰⵏⵉ حي الحسني, arrondissement de Hay Hassani مقاطعة الحي الحسني, préfecture d'arrondissement de Hay Hassani, Préfecture de Casablanca عمالة الدار البيضاء, Casablanca-Settat ⵜⵉⴳⵎⵉ ⵜⵓⵎⵍⵉⵍⵜ-ⵙⵟⵟⴰⵜ الدار البيضاء-سطات, 20200, Maroc / ⵍⵎⵖⵔⵉⴱ / المغرب"
38,38.0,Hay Hassani,140728.03125,26403.5,502900.9375,7957.65087890625,7843.76171875,113.88937377929688,0.004520093556494,0.291974395513535,20.0,62.0,10584.781062319435,36.0,33114.512602738345,146.0,0.0,3178.0179682038997,19.0,15351330.37,18249.94,12345.63,25737555.349999998,341715.85,808420.0700000001,108370.88,POINT (-7.651791243629023 33.56854226850842),"Rue Al Ourjouane, Anfa Clubs, arrondissement de Hay Hassani مقاطعة الحي الحسني, Pachalik de Casablanca, Préfecture de Casablanca عمالة الدار البيضاء, Casablanca-Settat ⵜⵉⴳⵎⵉ ⵜⵓⵎⵍⵉⵍⵜ-ⵙⵟⵟⴰⵜ الدار البيضاء-سطات, 20203, Maroc / ⵍⵎⵖⵔⵉⴱ / المغرب"
39,39.0,Hay Hassani,140728.03125,26403.5,502900.9375,7957.65087890625,7843.76171875,113.88937377929688,0.004520093556494,0.291974395513535,20.0,62.0,10584.781062319435,36.0,33114.512602738345,146.0,0.0,3178.0179682038997,19.0,15351330.37,18249.94,12345.63,25737555.349999998,341715.85,808420.0700000001,108370.88,POINT (-7.686021183106305 33.55780575075923),"El Oulfa ⵍⵡⴰⵍⴼⴰ الولفة, Hay Hassani ⵃⴰⵢ ⵍⵃⴰⵙⴰⵏⵉ حي الحسني, arrondissement de Hay Hassani مقاطعة الحي الحسني, préfecture d'arrondissement de Hay Hassani, Préfecture de Casablanca عمالة الدار البيضاء, Casablanca-Settat ⵜⵉⴳⵎⵉ ⵜⵓⵎⵍⵉⵍⵜ-ⵙⵟⵟⴰⵜ الدار البيضاء-سطات, 20202, Maroc / ⵍⵎⵖⵔⵉⴱ / المغرب"
40,40.0,Hay Mohammadi,106843.21875,20434.333984375,285371.125,10690.560546875,10950.435546875,0.0,0.000439336028649,0.119565218687057,10.0,13.0,8059.39675863865,31.0,4617.549671696419,25.0,0.0,3650.15744296251,7.0,4523934.31,314153.63999999996,0.0,0.0,0.0,0.0,0.0,POINT (-7.566759982285982 33.5771652253387),"Boulevard Ibnou Adara Al Marrakechi, arrondissement des Roches noires مقاطعة الصخور السوداء, préfecture d'arrondissements d'Aïn Sebaâ-Hay Mohammadi عمالة مقاطعات عين السبع الحي المحمدي, Préfecture de Casablanca عمالة الدار البيضاء, Casablanca-Settat ⵜⵉⴳⵎⵉ ⵜⵓⵎⵍⵉⵍⵜ-ⵙⵟⵟⴰⵜ الدار البيضاء-سطات, 20353, Maroc / ⵍⵎⵖⵔⵉⴱ / المغرب"
41,41.0,Hay Mohammadi,106843.21875,20434.333984375,285371.125,10690.560546875,10950.435546875,0.0,0.000439336028649,0.119565218687057,10.0,13.0,8059.39675863865,31.0,4617.549671696419,25.0,0.0,3650.15744296251,7.0,4523934.31,314153.63999999996,0.0,0.0,0.0,0.0,0.0,POINT (-7.557628015411628 33.57371103880315),"Bournazel, Moulay Rachid ⵎⵓⵍⴰⵢ ⵔⵛⵉⴷ مولاي رشيد, arrondissement de Moulay Rachid مقاطعة مولاي رشيد, préfecture d'arrondissements de Moulay Rachid, Préfecture de Casablanca عمالة الدار البيضاء, Casablanca-Settat ⵜⵉⴳⵎⵉ ⵜⵓⵎⵍⵉⵍⵜ-ⵙⵟⵟⴰⵜ الدار البيضاء-سطات, 20703, Maroc / ⵍⵎⵖⵔⵉⴱ / المغرب"
42,42.0,Hay Mohammadi,106843.21875,20434.333984375,285371.125,10690.560546875,10950.435546875,0.0,0.000439336028649,0.119565218687057,10.0,13.0,8059.39675863865,31.0,4617.549671696419,25.0,0.0,3650.15744296251,7.0,4523934.31,314153.63999999996,0.0,0.0,0.0,0.0,0.0,POINT (-7.579664410522142 33.58558153300675),"Rue Zineb Ishaq, arrondissement des Roches noires مقاطعة الصخور السوداء, préfecture d'arrondissements d'Aïn Sebaâ-Hay Mohammadi عمالة مقاطعات عين السبع الحي المحمدي, Préfecture de Casablanca عمالة الدار البيضاء, Casablanca-Settat ⵜⵉⴳⵎⵉ ⵜⵓⵎⵍⵉⵍⵜ-ⵙⵟⵟⴰⵜ الدار البيضاء-سطات, 20320, Maroc / ⵍⵎⵖⵔⵉⴱ / المغرب"
43,43.0,Hay Mohammadi,106843.21875,20434.333984375,285371.125,10690.560546875,10950.435546875,0.0,0.000439336028649,0.119565218687057,10.0,13.0,8059.39675863865,31.0,4617.549671696419,25.0,0.0,3650.15744296251,7.0,4523934.31,314153.63999999996,0.0,0.0,0.0,0.0,0.0,POINT (-7.552954125796059 33.57963408783898),"Autoroute Urbaine de Casablanca, arrondissement de Sidi Moumen مقاطعة سيدي مومن, préfecture d'arrondissements de Sidi Bernoussi عمالة مقاطعات سيدي البرنوصي, Préfecture de Casablanca عمالة الدار البيضاء, Casablanca-Settat ⵜⵉⴳⵎⵉ ⵜⵓⵎⵍⵉⵍⵜ-ⵙⵟⵟⴰⵜ الدار البيضاء-سطات, 20570, Maroc / ⵍⵎⵖⵔⵉⴱ / المغرب"
44,44.0,Hay Mohammadi,106843.21875,20434.333984375,285371.125,10690.560546875,10950.435546875,0.0,0.000439336028649,0.119565218687057,10.0,13.0,8059.39675863865,31.0,4617.549671696419,25.0,0.0,3650.15744296251,7.0,4523934.31,314153.63999999996,0.0,0.0,0.0,0.0,0.0,POINT (-7.565003146178025 33.58760968997529),"Hay Mohammadi ⵃⴰⵢ ⵎⵓⵃⴰⵎⴰⴷⵉ حي المحمدي, arrondissement de Hay Mohammadi مقاطعة الحي المحمدي, préfecture d'arrondissements d'Aïn Sebaâ-Hay Mohammadi عمالة مقاطعات عين السبع الحي المحمدي, Préfecture de Casablanca عمالة الدار البيضاء, Casablanca-Settat ⵜⵉⴳⵎⵉ ⵜⵓⵎⵍⵉⵍⵜ-ⵙⵟⵟⴰⵜ الدار البيضاء-سطات, 20353, Maroc / ⵍⵎⵖⵔⵉⴱ / المغرب"
45,45.0,Ain Chock,147945.0,24882.0,469360.0,10875.911132812502,10875.911132812502,0.0,0.001157070859335,0.153846502304077,0.0,25.0,8211.17106847609,49.0,13284.0604412588,39.0,0.0,0.0,0.0,11921014.52,15608.93,0.0,10509618.64,10678.36,78479.44,3527.58,POINT (-7.627368587781716 33.5234096623697),"Aîn-Chock ⵄⵉⵏ ⵛⴰⵇ عين الشق, arrondissement d'Aîn-Chock مقاطعة عين الشق, préfecture d'arrondissement d'Aïn Chock, Préfecture de Casablanca عمالة الدار البيضاء, Casablanca-Settat ⵜⵉⴳⵎⵉ ⵜⵓⵎⵍⵉⵍⵜ-ⵙⵟⵟⴰⵜ الدار البيضاء-سطات, 20460, Maroc / ⵍⵎⵖⵔⵉⴱ / المغرب"
46,46.0,Ain Chock,147945.0,24882.0,469360.0,10875.911132812502,10875.911132812502,0.0,0.001157070859335,0.153846502304077,0.0,25.0,8211.17106847609,49.0,13284.0604412588,39.0,0.0,0.0,0.0,11921014.52,15608.93,0.0,10509618.64,10678.36,78479.44,3527.58,POINT (-7.6319518606039 33.54026411129312),"Douar Khouadra, Boulevard de Fès, Bachkou, Zénith, Casablanca ⵜⵉⴳⵎⵉ ⵜⵓⵎⵍⵉⵍⵜ الدار البيضاء, Pachalik de Casablanca, Préfecture de Casablanca عمالة الدار البيضاء, Casablanca-Settat ⵜⵉⴳⵎⵉ ⵜⵓⵎⵍⵉⵍⵜ-ⵙⵟⵟⴰⵜ الدار البيضاء-سطات, 20001, Maroc / ⵍⵎⵖⵔⵉⴱ / المغرب"
47,47.0,Ain Chock,147945.0,24882.0,469360.0,10875.911132812502,10875.911132812502,0.0,0.001157070859335,0.153846502304077,0.0,25.0,8211.17106847609,49.0,13284.0604412588,39.0,0.0,0.0,0.0,11921014.52,15608.93,0.0,10509618.64,10678.36,78479.44,3527.58,POINT (-7.603443488370979 33.54653026056302),"Rue 21 زنقة, Aîn-Chock ⵄⵉⵏ ⵛⴰⵇ عين الشق, arrondissement d'Aîn-Chock مقاطعة عين الشق, préfecture d'arrondissement d'Aïn Chock, Préfecture de Casablanca عمالة الدار البيضاء, Casablanca-Settat ⵜⵉⴳⵎⵉ ⵜⵓⵎⵍⵉⵍⵜ-ⵙⵟⵟⴰⵜ الدار البيضاء-سطات, 20440, Maroc / ⵍⵎⵖⵔⵉⴱ / المغرب"
48,48.0,Ain Chock,147945.0,24882.0,469360.0,10875.911132812502,10875.911132812502,0.0,0.001157070859335,0.153846502304077,0.0,25.0,8211.17106847609,49.0,13284.0604412588,39.0,0.0,0.0,0.0,11921014.52,15608.93,0.0,10509618.64,10678.36,78479.44,3527.58,POINT (-7.620207488965399 33.53076443517872),"Café Route Andalouss, Boulevard Al Quds شارع القدس, Hay Mandarona, Aîn-Chock ⵄⵉⵏ ⵛⴰⵇ عين الشق, Casablanca ⵜⵉⴳⵎⵉ ⵜⵓⵎⵍⵉⵍⵜ الدار البيضاء, Pachalik de Casablanca, Préfecture de Casablanca عمالة الدار البيضاء, Casablanca-Settat ⵜⵉⴳⵎⵉ ⵜⵓⵎⵍⵉⵍⵜ-ⵙⵟⵟⴰⵜ الدار البيضاء-سطات, 20460, Maroc / ⵍⵎⵖⵔⵉⴱ / المغرب"
49,49.0,Ain Chock,147945.0,24882.0,469360.0,10875.911132812502,10875.911132812502,0.0,0.001157070859335,0.153846502304077,0.0,25.0,8211.17106847609,49.0,13284.0604412588,39.0,0.0,0.0,0.0,11921014.52,15608.93,0.0,10509618.64,10678.36,78479.44,3527.58,POINT (-7.60743119944375 33.5331373999159),"Hay Mandarona, Aîn-Chock ⵄⵉⵏ ⵛⴰⵇ عين الشق, arrondissement d'Aîn-Chock مقاطعة عين الشق, préfecture d'arrondissement d'Aïn Chock, Préfecture de Casablanca عمالة الدار البيضاء, Casablanca-Settat ⵜⵉⴳⵎⵉ ⵜⵓⵎⵍⵉⵍⵜ-ⵙⵟⵟⴰⵜ الدار البيضاء-سطات, 20152, Maroc / ⵍⵎⵖⵔⵉⴱ / المغرب"
50,50.0,Ain Sebaa,147102.609375,25559.923828125,214870.0,16482.4140625,16482.4140625,0.0,0.002186775673181,0.247850149869919,22.0,89.0,22637.611403761708,91.0,9764.857453112774,49.0,0.0,19358.498117813273,49.0,22512645.039999995,5780586.55,0.0,15479280.43,389388.74,41906.47,68143.04000000001,POINT (-7.527055886982375 33.60633088593887),"Fiori, Route de Rabat طريق الرباط, Aïn Sebaâ ⵄⵉⵏ ⵙⴱⴰⵄ عين السبع, Casablanca ⵜⵉⴳⵎⵉ ⵜⵓⵎⵍⵉⵍⵜ الدار البيضاء, Pachalik de Casablanca, Préfecture de Casablanca عمالة الدار البيضاء, Casablanca-Settat ⵜⵉⴳⵎⵉ ⵜⵓⵎⵍⵉⵍⵜ-ⵙⵟⵟⴰⵜ الدار البيضاء-سطات, 20254, Maroc / ⵍⵎⵖⵔⵉⴱ / المغرب"
51,51.0,Ain Sebaa,147102.609375,25559.923828125,214870.0,16482.4140625,16482.4140625,0.0,0.002186775673181,0.247850149869919,22.0,89.0,22637.611403761708,91.0,9764.857453112774,49.0,0.0,19358.498117813273,49.0,22512645.039999995,5780586.55,0.0,15479280.43,389388.74,41906.47,68143.04000000001,POINT (-7.552505825461063 33.59262534701576),"Dar Lamane, Aïn Sebaâ ⵄⵉⵏ ⵙⴱⴰⵄ عين السبع, arrondissement d'Aïn Sebaâ مقاطعة عين السبع, préfecture d'arrondissements d'Aïn Sebaâ-Hay Mohammadi عمالة مقاطعات عين السبع الحي المحمدي, Préfecture de Casablanca عمالة الدار البيضاء, Casablanca-Settat ⵜⵉⴳⵎⵉ ⵜⵓⵎⵍⵉⵍⵜ-ⵙⵟⵟⴰⵜ الدار البيضاء-سطات, 20352, Maroc / ⵍⵎⵖⵔⵉⴱ / المغرب"
52,52.0,Ain Sebaa,147102.609375,25559.923828125,214870.0,16482.4140625,16482.4140625,0.0,0.002186775673181,0.247850149869919,22.0,89.0,22637.611403761708,91.0,9764.857453112774,49.0,0.0,19358.498117813273,49.0,22512645.039999995,5780586.55,0.0,15479280.43,389388.74,41906.47,68143.04000000001,POINT (-7.530093623695426 33.61603358538719),"Pharmacie Fourkane صيدلية, Boulevard des Figuiers, Aïn Sebaâ ⵄⵉⵏ ⵙⴱⴰⵄ عين السبع, Casablanca ⵜⵉⴳⵎⵉ ⵜⵓⵎⵍⵉⵍⵜ الدار البيضاء, Pachalik de Casablanca, Préfecture de Casablanca عمالة الدار البيضاء, Casablanca-Settat ⵜⵉⴳⵎⵉ ⵜⵓⵎⵍⵉⵍⵜ-ⵙⵟⵟⴰⵜ الدار البيضاء-سطات, 20252, Maroc / ⵍⵎⵖⵔⵉⴱ / المغرب"
53,53.0,Ain Sebaa,147102.609375,25559.923828125,214870.0,16482.4140625,16482.4140625,0.0,0.002186775673181,0.247850149869919,22.0,89.0,22637.611403761708,91.0,9764.857453112774,49.0,0.0,19358.498117813273,49.0,22512645.039999995,5780586.55,0.0,15479280.43,389388.74,41906.47,68143.04000000001,POINT (-7.57101707232315 33.6086212940201),"Boulevard Moulay Slimane, arrondissement des Roches noires مقاطعة الصخور السوداء, préfecture d'arrondissements d'Aïn Sebaâ-Hay Mohammadi عمالة مقاطعات عين السبع الحي المحمدي, Préfecture de Casablanca عمالة الدار البيضاء, Casablanca-Settat ⵜⵉⴳⵎⵉ ⵜⵓⵎⵍⵉⵍⵜ-ⵙⵟⵟⴰⵜ الدار البيضاء-سطات, 20303, Maroc / ⵍⵎⵖⵔⵉⴱ / المغرب"
54,54.0,Ain Sebaa,147102.609375,25559.923828125,214870.0,16482.4140625,16482.4140625,0.0,0.002186775673181,0.247850149869919,22.0,89.0,22637.611403761708,91.0,9764.857453112774,49.0,0.0,19358.498117813273,49.0,22512645.039999995,5780586.55,0.0,15479280.43,389388.74,41906.47,68143.04000000001,POINT (-7.514349381506551 33.58758253456271),"Boulevard Mohamed Al Bakkali, Carrières Rehamna كريان الرحامنة, Sidi Moumen ⵙⵉⴷⵉ ⵎⵓⵎⴰⵏ سيدي مومن, arrondissement de Sidi Moumen مقاطعة سيدي مومن, préfecture d'arrondissements de Sidi Bernoussi عمالة مقاطعات سيدي البرنوصي, Préfecture de Casablanca عمالة الدار البيضاء, Casablanca-Settat ⵜⵉⴳⵎⵉ ⵜⵓⵎⵍⵉⵍⵜ-ⵙⵟⵟⴰⵜ الدار البيضاء-سطات, 20046, Maroc / ⵍⵎⵖⵔⵉⴱ / المغرب"
55,55.0,Al Fida,155982.375,31322.0,575976.25,35225.5,28880.687500000004,0.0,0.000175240216777,0.074554346501827,2.0,20.0,4653.552514077015,23.0,5075.828120212355,41.0,0.0,0.0,0.0,1804727.91,0.0,0.0,3263788.84,13596.12,0.0,12239.58,POINT (-7.598058645606782 33.57013445164309),"Rue 27, Hay El Amal, Al Fida ⵍⴼⵉⴷⴰ ا لفداء, arrondissement d'Al Fida مقاطعة الفداء, préfecture d’arrondissements Al Fida-Mers Sultan عمالة مقاطعات الفداء مرس السلطان, Préfecture de Casablanca عمالة الدار البيضاء, Casablanca-Settat ⵜⵉⴳⵎⵉ ⵜⵓⵎⵍⵉⵍⵜ-ⵙⵟⵟⴰⵜ الدار البيضاء-سطات, 20552, Maroc / ⵍⵎⵖⵔⵉⴱ / المغرب"
56,56.0,Al Fida,155982.375,31322.0,575976.25,35225.5,28880.687500000004,0.0,0.000175240216777,0.074554346501827,2.0,20.0,4653.552514077015,23.0,5075.828120212355,41.0,0.0,0.0,0.0,1804727.91,0.0,0.0,3263788.84,13596.12,0.0,12239.58,POINT (-7.599870730141732 33.56363154284882),"Souk Korea, Rue des Sraghna, Hay El Amal, Al Fida ⵍⴼⵉⴷⴰ ا لفداء, Casablanca ⵜⵉⴳⵎⵉ ⵜⵓⵎⵍⵉⵍⵜ الدار البيضاء, Pachalik de Casablanca, Préfecture de Casablanca عمالة الدار البيضاء, Casablanca-Settat ⵜⵉⴳⵎⵉ ⵜⵓⵎⵍⵉⵍⵜ-ⵙⵟⵟⴰⵜ الدار البيضاء-سطات, 20062, Maroc / ⵍⵎⵖⵔⵉⴱ / المغرب"
57,57.0,Al Fida,155982.375,31322.0,575976.25,35225.5,28880.687500000004,0.0,0.000175240216777,0.074554346501827,2.0,20.0,4653.552514077015,23.0,5075.828120212355,41.0,0.0,0.0,0.0,1804727.91,0.0,0.0,3263788.84,13596.12,0.0,12239.58,POINT (-7.590697357199 33.56472392017348),"Boulevard Bouchaib Doukkali, Hay El Farah, arrondissement d'Al Fida مقاطعة الفداء, préfecture d’arrondissements Al Fida-Mers Sultan عمالة مقاطعات الفداء مرس السلطان, Préfecture de Casablanca عمالة الدار البيضاء, Casablanca-Settat ⵜⵉⴳⵎⵉ ⵜⵓⵎⵍⵉⵍⵜ-ⵙⵟⵟⴰⵜ الدار البيضاء-سطات, 20530, Maroc / ⵍⵎⵖⵔⵉⴱ / المغرب"
58,58.0,Al Fida,155982.375,31322.0,575976.25,35225.5,28880.687500000004,0.0,0.000175240216777,0.074554346501827,2.0,20.0,4653.552514077015,23.0,5075.828120212355,41.0,0.0,0.0,0.0,1804727.91,0.0,0.0,3263788.84,13596.12,0.0,12239.58,POINT (-7.584284043045241 33.56704661642497),"Rue 29, Hay El Farah, arrondissement d'Al Fida مقاطعة الفداء, préfecture d’arrondissements Al Fida-Mers Sultan عمالة مقاطعات الفداء مرس السلطان, Préfecture de Casablanca عمالة الدار البيضاء, Casablanca-Settat ⵜⵉⴳⵎⵉ ⵜⵓⵎⵍⵉⵍⵜ-ⵙⵟⵟⴰⵜ الدار البيضاء-سطات, 20530, Maroc / ⵍⵎⵖⵔⵉⴱ / المغرب"
59,59.0,Al Fida,155982.375,31322.0,575976.25,35225.5,28880.687500000004,0.0,0.000175240216777,0.074554346501827,2.0,20.0,4653.552514077015,23.0,5075.828120212355,41.0,0.0,0.0,0.0,1804727.91,0.0,0.0,3263788.84,13596.12,0.0,12239.58,POINT (-7.606299844625026 33.56228433343239),"Boulevard Bouchaib Doukkali, Bouchentouf, Al Fida ⵍⴼⵉⴷⴰ ا لفداء, arrondissement d'Al Fida مقاطعة الفداء, Pachalik de Casablanca, Préfecture de Casablanca عمالة الدار البيضاء, Casablanca-Settat ⵜⵉⴳⵎⵉ ⵜⵓⵎⵍⵉⵍⵜ-ⵙⵟⵟⴰⵜ الدار البيضاء-سطات, 20550, Maroc / ⵍⵎⵖⵔⵉⴱ / المغرب"
60,60.0,Al Idrissia,109565.0,20423.0,621221.0,41799.21875,41799.21875,0.0,0.000174184475327,0.057800300419331,0.0,14.0,1698.5371317441484,18.0,6393.576311686777,40.0,0.0,3812.5766263399037,9.0,1793994.56,24591.84,0.0,1958550.2399999998,63843.8,0.0,0.0,POINT (-7.575982165377473 33.56010266368082),"Boulevard Abou Horaira, Khaddouj Hlima, Ben M'Sick ⴱⴰⵏ ⵎⵙⵉⴽ ابن امسيك, arrondissement de Ben M'Sick مقاطعة ابن امسيك, préfecture d'arrondissements de Ben M'sick, Préfecture de Casablanca عمالة الدار البيضاء, Casablanca-Settat ⵜⵉⴳⵎⵉ ⵜⵓⵎⵍⵉⵍⵜ-ⵙⵟⵟⴰⵜ الدار البيضاء-سطات, 20705, Maroc / ⵍⵎⵖⵔⵉⴱ / المغرب"
61,61.0,Al Idrissia,109565.0,20423.0,621221.0,41799.21875,41799.21875,0.0,0.000174184475327,0.057800300419331,0.0,14.0,1698.5371317441484,18.0,6393.576311686777,40.0,0.0,3812.5766263399037,9.0,1793994.56,24591.84,0.0,1958550.2399999998,63843.8,0.0,0.0,POINT (-7.589924996035013 33.55912952367036),"Lycée de Ben M'sick ثانوية بن ميسك, Boulevard Abdellah Senhaji, Calogera, Ben M'Sick ⴱⴰⵏ ⵎⵙⵉⴽ ابن امسيك, Casablanca ⵜⵉⴳⵎⵉ ⵜⵓⵎⵍⵉⵍⵜ الدار البيضاء, Pachalik de Casablanca, Préfecture de Casablanca عمالة الدار البيضاء, Casablanca-Settat ⵜⵉⴳⵎⵉ ⵜⵓⵎⵍⵉⵍⵜ-ⵙⵟⵟⴰⵜ الدار البيضاء-سطات, 20450, Maroc / ⵍⵎⵖⵔⵉⴱ / المغرب"
62,62.0,Al Idrissia,109565.0,20423.0,621221.0,41799.21875,41799.21875,0.0,0.000174184475327,0.057800300419331,0.0,14.0,1698.5371317441484,18.0,6393.576311686777,40.0,0.0,3812.5766263399037,9.0,1793994.56,24591.84,0.0,1958550.2399999998,63843.8,0.0,0.0,POINT (-7.583308487699777 33.56202488728205),"Calogera, Ben M'Sick ⴱⴰⵏ ⵎⵙⵉⴽ ابن امسيك, arrondissement de Ben M'Sick مقاطعة ابن امسيك, préfecture d'arrondissements de Ben M'sick, Préfecture de Casablanca عمالة الدار البيضاء, Casablanca-Settat ⵜⵉⴳⵎⵉ ⵜⵓⵎⵍⵉⵍⵜ-ⵙⵟⵟⴰⵜ الدار البيضاء-سطات, 20530, Maroc / ⵍⵎⵖⵔⵉⴱ / المغرب"
63,63.0,Al Idrissia,109565.0,20423.0,621221.0,41799.21875,41799.21875,0.0,0.000174184475327,0.057800300419331,0.0,14.0,1698.5371317441484,18.0,6393.576311686777,40.0,0.0,3812.5766263399037,9.0,1793994.56,24591.84,0.0,1958550.2399999998,63843.8,0.0,0.0,POINT (-7.594587085834851 33.56304333970278),"King Animalerie, Rue 3 زنقة, Idrissia, Al Fida ⵍⴼⵉⴷⴰ ا لفداء, Casablanca ⵜⵉⴳⵎⵉ ⵜⵓⵎⵍⵉⵍⵜ الدار البيضاء, Pachalik de Casablanca, Préfecture de Casablanca عمالة الدار البيضاء, Casablanca-Settat ⵜⵉⴳⵎⵉ ⵜⵓⵎⵍⵉⵍⵜ-ⵙⵟⵟⴰⵜ الدار البيضاء-سطات, 20552, Maroc / ⵍⵎⵖⵔⵉⴱ / المغرب"
64,64.0,Al Idrissia,109565.0,20423.0,621221.0,41799.21875,41799.21875,0.0,0.000174184475327,0.057800300419331,0.0,14.0,1698.5371317441484,18.0,6393.576311686777,40.0,0.0,3812.5766263399037,9.0,1793994.56,24591.84,0.0,1958550.2399999998,63843.8,0.0,0.0,POINT (-7.580900112798377 33.55644267492753),"Khaddouj Hlima, Ben M'Sick ⴱⴰⵏ ⵎⵙⵉⴽ ابن امسيك, arrondissement de Ben M'Sick مقاطعة ابن امسيك, préfecture d'arrondissements de Ben M'sick, Préfecture de Casablanca عمالة الدار البيضاء, Casablanca-Settat ⵜⵉⴳⵎⵉ ⵜⵓⵎⵍⵉⵍⵜ-ⵙⵟⵟⴰⵜ الدار البيضاء-سطات, 20430, Maroc / ⵍⵎⵖⵔⵉⴱ / المغرب"
65,65.0,Lissasfa,44568.28515625,8215.7138671875,683488.5625,1176.2685546875,887.0257568359375,289.2428588867187,0.008158286102116,0.466271698474884,2.0,23.0,2979.9230120839584,15.0,1143.3124896450477,4.0,1.0,6369.59530826795,24.0,10720248.9,1200871.34,0.0,4784759.34,43904.96,2342.12,5666.639999999999,POINT (-7.680956044302029 33.51749346173515),"Riad Sofia ⵔⵉⵢⴰⴷ ⵚoⴼⵉⵢⴰ رياض صوفيا, arrondissement de Hay Hassani مقاطعة الحي الحسني, préfecture d'arrondissement de Hay Hassani, Préfecture de Casablanca عمالة الدار البيضاء, Casablanca-Settat ⵜⵉⴳⵎⵉ ⵜⵓⵎⵍⵉⵍⵜ-ⵙⵟⵟⴰⵜ الدار البيضاء-سطات, 20232, Maroc / ⵍⵎⵖⵔⵉⴱ / المغرب"
66,66.0,Lissasfa,44568.28515625,8215.7138671875,683488.5625,1176.2685546875,887.0257568359375,289.2428588867187,0.008158286102116,0.466271698474884,2.0,23.0,2979.9230120839584,15.0,1143.3124896450477,4.0,1.0,6369.59530826795,24.0,10720248.9,1200871.34,0.0,4784759.34,43904.96,2342.12,5666.639999999999,POINT (-7.666391027334933 33.51459861043016),"Ennassim, arrondissement de Hay Hassani مقاطعة الحي الحسني, préfecture d'arrondissement de Hay Hassani, Préfecture de Casablanca عمالة الدار البيضاء, Casablanca-Settat ⵜⵉⴳⵎⵉ ⵜⵓⵎⵍⵉⵍⵜ-ⵙⵟⵟⴰⵜ الدار البيضاء-سطات, 20192, Maroc / ⵍⵎⵖⵔⵉⴱ / المغرب"
67,67.0,Lissasfa,44568.28515625,8215.7138671875,683488.5625,1176.2685546875,887.0257568359375,289.2428588867187,0.008158286102116,0.466271698474884,2.0,23.0,2979.9230120839584,15.0,1143.3124896450477,4.0,1.0,6369.59530826795,24.0,10720248.9,1200871.34,0.0,4784759.34,43904.96,2342.12,5666.639999999999,POINT (-7.675116290969239 33.53203265104496),"Lissasfa, arrondissement de Hay Hassani مقاطعة الحي الحسني, préfecture d'arrondissement de Hay Hassani, Préfecture de Casablanca عمالة الدار البيضاء, Casablanca-Settat ⵜⵉⴳⵎⵉ ⵜⵓⵎⵍⵉⵍⵜ-ⵙⵟⵟⴰⵜ الدار البيضاء-سطات, 20232, Maroc / ⵍⵎⵖⵔⵉⴱ / المغرب"
68,68.0,Lissasfa,44568.28515625,8215.7138671875,683488.5625,1176.2685546875,887.0257568359375,289.2428588867187,0.008158286102116,0.466271698474884,2.0,23.0,2979.9230120839584,15.0,1143.3124896450477,4.0,1.0,6369.59530826795,24.0,10720248.9,1200871.34,0.0,4784759.34,43904.96,2342.12,5666.639999999999,POINT (-7.661786280457402 33.52105989797821),"Abouab Ennassim, Pénétrante d'Azbane, Ennassim, Casablanca ⵜⵉⴳⵎⵉ ⵜⵓⵎⵍⵉⵍⵜ الدار البيضاء, Pachalik de Casablanca, Préfecture de Casablanca عمالة الدار البيضاء, Casablanca-Settat ⵜⵉⴳⵎⵉ ⵜⵓⵎⵍⵉⵍⵜ-ⵙⵟⵟⴰⵜ الدار البيضاء-سطات, 20084, Maroc / ⵍⵎⵖⵔⵉⴱ / المغرب"
69,69.0,Lissasfa,44568.28515625,8215.7138671875,683488.5625,1176.2685546875,887.0257568359375,289.2428588867187,0.008158286102116,0.466271698474884,2.0,23.0,2979.9230120839584,15.0,1143.3124896450477,4.0,1.0,6369.59530826795,24.0,10720248.9,1200871.34,0.0,4784759.34,43904.96,2342.12,5666.639999999999,POINT (-7.645725361717879 33.53278464788346),"Sidi Maarouf, Zénith, arrondissement d'Aîn-Chock مقاطعة عين الشق, préfecture d'arrondissement d'Aïn Chock, Préfecture de Casablanca عمالة الدار البيضاء, Casablanca-Settat ⵜⵉⴳⵎⵉ ⵜⵓⵎⵍⵉⵍⵜ-ⵙⵟⵟⴰⵜ الدار البيضاء-سطات, 20190, Maroc / ⵍⵎⵖⵔⵉⴱ / المغرب"
