,rand_point,COMMUNE,POP_TOT,MENAGES,AREA,DENSITE,DENS_URB,DENS_RUR,Shape_Area,Shape_Leng,NUMTram_St,NUMBus_Sta,Leng_Prima,Count_Prim,Leng_Secon,Count_Seco,Num_Speed_,Leng_Motor,Count_Moto,Zone_Area,Indu_Area,Commercial,residencia,Park_Area,University,Parking_Ar,geometry,address
104,104.0,Sidi Bernoussi,151863.90625,27067.908203124996,395802.71875,10197.641601562498,10197.641601562498,0.0,0.001390232820995,0.166434124112129,6.0,53.0,7672.6497098544905,21.0,8293.771169901962,27.0,0.0,14789.35648695618,29.0,14310266.1,4845999.24,0.0,44125501.49,207340.55000000002,0.0,47605.369999999995,POINT (-7.508214790020274 33.6254822778288),"Boulevard Al Bina, Zone Industriele de Sidi Bernoussi, Sidi Bernoussi ⵙⵉⴷⵉ ⵍⴱⵔⵏⵓⵚⵉ سيدي البرنوصي, arrondissement de Sidi Bernoussi مقاطعة سيدي البرنوصي, préfecture d'arrondissements de Sidi Bernoussi عمالة مقاطعات سيدي البرنوصي, Préfecture de Casablanca عمالة الدار البيضاء, Casablanca-Settat ⵜⵉⴳⵎⵉ ⵜⵓⵎⵍⵉⵍⵜ-ⵙⵟⵟⴰⵜ الدار البيضاء-سطات, 20605, Maroc / ⵍⵎⵖⵔⵉⴱ / المغرب"
105,105.0,Ain Harrouda,27741.0,4839.0,892140.0,1327.8199462890625,1327.8199462890625,0.0,0.002607586560771,0.24841083586216,0.0,13.0,2816.807153042769,4.0,0.0,0.0,1.0,5249.450692957153,4.0,26831957.89,1854275.37,0.0,0.0,61764.54,0.0,0.0,POINT (-7.457180427090425 33.64718985604458),"RP3017, Ain Harrouda عين حرودة, Pachalik de Ain Harrouda, Préfecture de Mohammédia عمالة المحمدية, Casablanca-Settat ⵜⵉⴳⵎⵉ ⵜⵓⵎⵍⵉⵍⵜ-ⵙⵟⵟⴰⵜ الدار البيضاء-سطات, 28632, Maroc / ⵍⵎⵖⵔⵉⴱ / المغرب"
106,106.0,Ain Harrouda,27741.0,4839.0,892140.0,1327.8199462890625,1327.8199462890625,0.0,0.002607586560771,0.24841083586216,0.0,13.0,2816.807153042769,4.0,0.0,0.0,1.0,5249.450692957153,4.0,26831957.89,1854275.37,0.0,0.0,61764.54,0.0,0.0,POINT (-7.452339628729277 33.62789211306954),"RN9, Ain Harrouda عين حرودة, Pachalik de Ain Harrouda, Préfecture de Mohammédia عمالة المحمدية, Casablanca-Settat ⵜⵉⴳⵎⵉ ⵜⵓⵎⵍⵉⵍⵜ-ⵙⵟⵟⴰⵜ الدار البيضاء-سطات, 28630, Maroc / ⵍⵎⵖⵔⵉⴱ / المغرب"
107,107.0,Ain Harrouda,27741.0,4839.0,892140.0,1327.8199462890625,1327.8199462890625,0.0,0.002607586560771,0.24841083586216,0.0,13.0,2816.807153042769,4.0,0.0,0.0,1.0,5249.450692957153,4.0,26831957.89,1854275.37,0.0,0.0,61764.54,0.0,0.0,POINT (-7.445133740030889 33.65142425705229),"Ain Harrouda عين حرودة, Pachalik de Ain Harrouda, Préfecture de Mohammédia عمالة المحمدية, Casablanca-Settat ⵜⵉⴳⵎⵉ ⵜⵓⵎⵍⵉⵍⵜ-ⵙⵟⵟⴰⵜ الدار البيضاء-سطات, 28632, Maroc / ⵍⵎⵖⵔⵉⴱ / المغرب"
108,108.0,Ain Harrouda,27741.0,4839.0,892140.0,1327.8199462890625,1327.8199462890625,0.0,0.002607586560771,0.24841083586216,0.0,13.0,2816.807153042769,4.0,0.0,0.0,1.0,5249.450692957153,4.0,26831957.89,1854275.37,0.0,0.0,61764.54,0.0,0.0,POINT (-7.449439223058281 33.63654928610504),"RN9, Ain Harrouda عين حرودة, Pachalik de Ain Harrouda, Préfecture de Mohammédia عمالة المحمدية, Casablanca-Settat ⵜⵉⴳⵎⵉ ⵜⵓⵎⵍⵉⵍⵜ-ⵙⵟⵟⴰⵜ الدار البيضاء-سطات, 28632, Maroc / ⵍⵎⵖⵔⵉⴱ / المغرب"
109,109.0,Ain Harrouda,27741.0,4839.0,892140.0,1327.8199462890625,1327.8199462890625,0.0,0.002607586560771,0.24841083586216,0.0,13.0,2816.807153042769,4.0,0.0,0.0,1.0,5249.450692957153,4.0,26831957.89,1854275.37,0.0,0.0,61764.54,0.0,0.0,POINT (-7.481530279613996 33.62444013010303),"arrondissement de Sidi Bernoussi مقاطعة سيدي البرنوصي, préfecture d'arrondissements de Sidi Bernoussi عمالة مقاطعات سيدي البرنوصي, Préfecture de Casablanca عمالة الدار البيضاء, Casablanca-Settat ⵜⵉⴳⵎⵉ ⵜⵓⵎⵍⵉⵍⵜ-ⵙⵟⵟⴰⵜ الدار البيضاء-سطات, 200000, Maroc / ⵍⵎⵖⵔⵉⴱ / المغرب"
110,110.0,Moulay Youssef,88758.46875,17080.8828125,473553.25,12660.2099609375,12660.2099609375,0.0,0.000349612091668,0.158626869320869,0.0,19.0,11759.860024863281,59.0,7008.58575507459,38.0,0.0,4526.71034864061,20.0,3599081.27,168018.36,1215.52,36680535.160000004,34024.53,0.0,23493.08,POINT (-7.634421075102676 33.59958307991021),"Pneu réparation, Boulevard de Bordeaux, Sidi Belyout ⵙⵉⴷⵉ ⴱⵍⵢⵓⵟ سيدي بليوط, arrondissement de Sidi Belyout مقاطعة سيدي بليوط, Pachalik de Casablanca, Préfecture de Casablanca عمالة الدار البيضاء, Casablanca-Settat ⵜⵉⴳⵎⵉ ⵜⵓⵎⵍⵉⵍⵜ-ⵙⵟⵟⴰⵜ الدار البيضاء-سطات, 20040, Maroc / ⵍⵎⵖⵔⵉⴱ / المغرب"
111,111.0,Moulay Youssef,88758.46875,17080.8828125,473553.25,12660.2099609375,12660.2099609375,0.0,0.000349612091668,0.158626869320869,0.0,19.0,11759.860024863281,59.0,7008.58575507459,38.0,0.0,4526.71034864061,20.0,3599081.27,168018.36,1215.52,36680535.160000004,34024.53,0.0,23493.08,POINT (-7.619358756790684 33.60559831974439),"ميناء الدار البيضاء Port de Casablanca, Sidi Belyout ⵙⵉⴷⵉ ⴱⵍⵢⵓⵟ سيدي بليوط, Casablanca ⵜⵉⴳⵎⵉ ⵜⵓⵎⵍⵉⵍⵜ الدار البيضاء, Pachalik de Casablanca, Préfecture de Casablanca عمالة الدار البيضاء, Casablanca-Settat ⵜⵉⴳⵎⵉ ⵜⵓⵎⵍⵉⵍⵜ-ⵙⵟⵟⴰⵜ الدار البيضاء-سطات, 20004, Maroc / ⵍⵎⵖⵔⵉⴱ / المغرب"
112,112.0,Moulay Youssef,88758.46875,17080.8828125,473553.25,12660.2099609375,12660.2099609375,0.0,0.000349612091668,0.158626869320869,0.0,19.0,11759.860024863281,59.0,7008.58575507459,38.0,0.0,4526.71034864061,20.0,3599081.27,168018.36,1215.52,36680535.160000004,34024.53,0.0,23493.08,POINT (-7.628564980019771 33.60534333123121),"Parc des expositions, Derb Tazi Rue 1, Sour Jdid السور الجديد, Casablanca ⵜⵉⴳⵎⵉ ⵜⵓⵎⵍⵉⵍⵜ الدار البيضاء, Pachalik de Casablanca, Préfecture de Casablanca عمالة الدار البيضاء, Casablanca-Settat ⵜⵉⴳⵎⵉ ⵜⵓⵎⵍⵉⵍⵜ-ⵙⵟⵟⴰⵜ الدار البيضاء-سطات, 20000, Maroc / ⵍⵎⵖⵔⵉⴱ / المغرب"
113,113.0,Moulay Youssef,88758.46875,17080.8828125,473553.25,12660.2099609375,12660.2099609375,0.0,0.000349612091668,0.158626869320869,0.0,19.0,11759.860024863281,59.0,7008.58575507459,38.0,0.0,4526.71034864061,20.0,3599081.27,168018.36,1215.52,36680535.160000004,34024.53,0.0,23493.08,POINT (-7.609199075481694 33.61231389195819),"ميناء الدار البيضاء Port de Casablanca, Sidi Belyout ⵙⵉⴷⵉ ⴱⵍⵢⵓⵟ سيدي بليوط, Casablanca ⵜⵉⴳⵎⵉ ⵜⵓⵎⵍⵉⵍⵜ الدار البيضاء, Pachalik de Casablanca, Préfecture de Casablanca عمالة الدار البيضاء, Casablanca-Settat ⵜⵉⴳⵎⵉ ⵜⵓⵎⵍⵉⵍⵜ-ⵙⵟⵟⴰⵜ الدار البيضاء-سطات, 20004, Maroc / ⵍⵎⵖⵔⵉⴱ / المغرب"
114,114.0,Moulay Youssef,88758.46875,17080.8828125,473553.25,12660.2099609375,12660.2099609375,0.0,0.000349612091668,0.158626869320869,0.0,19.0,11759.860024863281,59.0,7008.58575507459,38.0,0.0,4526.71034864061,20.0,3599081.27,168018.36,1215.52,36680535.160000004,34024.53,0.0,23493.08,POINT (-7.637821262107074 33.59180443723376),
